Name,Description,Image
Fountain Pens,"Meet the real you.
Let your personality flow through the prism of your nib.",https://zyllio.github.io/zyllio-samples/pens/categories/Fountain_pen_300x.avif
Ballpoint Pens,"Clean lines and to the point!
Our classic ballpoints make it easy to write.
",https://zyllio.github.io/zyllio-samples/pens/categories/RollerBall_300x.avif
Gift Sets,"Ready, Steady, Gift!
Discover incredible gift sets for all occasions.",https://zyllio.github.io/zyllio-samples/pens/categories/collection_gift_set_2_300x.avif
Our Refills,"Refuel and recharge!
Find the perfect refill for your pen.",https://zyllio.github.io/zyllio-samples/pens/categories/FAccessories_300x.avif