Name,Price,Image,Description
Margherita,11.60,https://zyllio.github.io/zyllio-samples/pizzas/pizzas/magherita.jpg,"Tomato, mozzarella and basil"
Piccante,14,https://zyllio.github.io/zyllio-samples/pizzas/pizzas/piccante.jpg,"Tomato, mozzarella, 'nduja sausage, chicken, mascarpone, chilli, garlic and rocket"
Prosciutto Bufala,13.22,https://zyllio.github.io/zyllio-samples/pizzas/pizzas/bufala.jpg,"Tomato, mozzarella, prosciutto, bufala mozzarella and rocket"
Formaggio Funghi,9.20,https://zyllio.github.io/zyllio-samples/pizzas/pizzas/funghi.jpg,"Chestnut mushrooms, mozzarella, dolcelatte and pecorino cheese on a creamy mascarpone base"
Pepperoni,15.10,https://zyllio.github.io/zyllio-samples/pizzas/pizzas/funghi.jpg,"Tomato, mozzarella, salami piccante, red onion, garlic and rocket"
Salsiccia Broccoli,12.50,https://zyllio.github.io/zyllio-samples/pizzas/pizzas/salsiccia.jpg,"Basilicata sausage, tenderstem broccoli, red chilli & garlic topped with mozzarella and pecorino cheese on a creamy mascarpone base with a drizzle of balsamic glaze"
Diavolo,13.30,https://zyllio.github.io/zyllio-samples/pizzas/pizzas/diavolo.jpg,"Tomato, mozzarella, salami piccante, scotch bonnet chilli and ‘nduja sausage with two sauces on the side: srirarcha for an extra hot kick and mint yogurt for a cooling effect"